link,title,snippet,date,source
https://www.bloomberg.com/news/newsletters/2024-01-21/apple-vision-pro-lack-of-netflix-youtube-app-store-tensions-threaten-device-lrnjwjb3,"Apple Vision Pro: Lack of Netflix, YouTube, App Store Tensions Threaten 
Device","Apple's new Vision Pro will lack some key apps when it debuts, renewing 
concerns about an already-tense relationship with certain developers...",1 month ago,Bloomberg
https://www.bloomberg.com/news/articles/2024-01-08/iphone-sales-in-china-to-fall-double-digits-jefferies-says,"IPhone Sales in China to Fall Double Digits, Jefferies Says","Apple Inc.'s iPhone sales slump in China is deepening and the company is 
likely to see volumes decline further this year, according to...",1 month ago,Bloomberg.com
https://fortune.com/2023/10/11/google-ceo-sundar-pichai-founders-larry-page-sergey-brin-bad-optics-search-engine-deal-apple-chrome/,"Google CEO Pichai wrote to founders Page and Brin to decry bad ‘optics’ of 
search engine deal with Apple when he was in charge of Chrome","Google's Sundar Pichai raised concerns years before he became the company's 
chief executive officer that its deal with Apple Inc. had bad...","Oct 11, 2023",Fortune
https://www.bloomberg.com/news/newsletters/2024-01-24/apple-vision-pro-plays-defense-against-meta-quest-vr-headset,Apple Vision Pro Plays Defense Against Meta Quest VR Headset,"The Apple headset looks like a form of insurance against Meta. But first… 
Three things you need to know today:.",1 month ago,Bloomberg.com
https://news.bloomberglaw.com/ip-law/apples-wins-at-patent-tribunal-upheld-as-masimo-loses-appeal,Apple's Wins at Patent Tribunal Upheld As Masimo Loses Appeal,"Apple Inc.'s victories at an administrative tribunal that voided two 
patents Masimo Corp. alleged the Apple Watch infringes will stand,...",1 month ago,Bloomberg Law News
https://www.cnbc.com/2023/08/01/apple-could-benefit-in-china-from-users-spending-more-on-smartphones.html,"Chinese are forking out more money for smartphones despite wider slowdown — 
that's good news for Apple","The average selling price of smartphones in China is on the rise even as 
the overall market declines. This is positive for sales of Apple's...","Jul 31, 2023",CNBC
https://www.law360.com/articles/1773864/fed-circ-wrestles-with-apple-bid-to-ax-more-masimo-patents,Fed. Circ. Wrestles With Apple Bid To Ax More Masimo Patents,"Federal Circuit judges on Wednesday questioned Apple Inc.'s contention that 
the Patent Trial and Appeal Board wrongly upheld the validity of...","Dec 6, 2023",Law360
https://www.business-standard.com/technology/tech-news/apple-gets-warning-from-top-us-consumer-watchdog-on-tap-to-pay-tech-123090701365_1.html,Apple gets warning from top US consumer watchdog on Tap To Pay tech,"Tap-to-pay transactions have exploded in recent years as mobile devices 
became ever-present, making paying via a smartphone more and more...","Sep 7, 2023",Business Standard
https://www.bloomberg.com/news/articles/2023-10-31/apple-s-app-charges-violate-eu-antitrust-law-dutch-agency-says,"Apple's App Charges Violate EU Antitrust Law, Dutch Agency Says","Apple Inc. could be forced to scale back its App Store fees for developers 
after one of the European Union's antitrust watchdogs said its...","Oct 31, 2023",Bloomberg
https://www.bloomberg.com/news/articles/2023-12-06/apple-aapl-executive-who-invented-iphone-multitouch-and-touch-id-leaving,"Apple's (AAPL) Steve Hotelling, Who Invented iPhone Screen and Touch ID, 
Retires","Apple Inc.'s senior executive overseeing touch-screen technology, health 
sensors and the company's Face ID interface is leaving the company,...","Dec 6, 2023",Bloomberg
https://www.bloomberg.com/news/articles/2023-09-08/apple-event-2023-iphone-15-pro-max-airpods-watch-series-9-products-to-expect,"Apple Event 2023: iPhone 15 Pro Max, AirPods, Watch Series 9, Products to 
Expect","Company will spotlight titanium iPhone 15 Pro and cameras, switch to USB-C 
chargers and faster smartwatches.","Sep 8, 2023",Bloomberg
https://tech.hindustantimes.com/tech/news/apple-2023-event-high-stakes-iphone-15-launch-explained-in-5-charts-71694460135678.html,Apple 2023 event: High-stakes iPhone 15 launch explained in 5 charts,"Apple event 2023: Apple Inc.'s annual iPhone unveiling is always its most 
momentous time of the year — a chance to impress consumers with...","Sep 12, 2023",HT Tech
https://www.bloomberg.com/news/newsletters/2023-10-01/could-apple-replace-google-with-own-search-engine-it-s-possible-but-unlikely-ln7gywed,"Could Apple Replace Google With Own Search Engine? It's Possible, but 
Unlikely","Apple has the wherewithal to launch its own search engine, a replacement 
for Google. And Microsoft even approached the company about helping...","Oct 1, 2023",Bloomberg
https://siliconangle.com/2023/07/20/apple-warns-will-pull-popular-apps-uk-surveillance-law-changes-planned/,"Apple warns it will pull popular apps from UK if surveillance law changes 
as planned","Apple Inc. warned today that if British surveillance laws change with the 
upcoming Online Safety Bill, it might have no choice but to pull...","Jul 20, 2023",SiliconANGLE
https://finance.yahoo.com/news/masimo-ceo-open-settling-apple-190741402.html,"Masimo CEO Open to Settling Apple Watch Rift But Says 'It Takes Two to 
Tango'","(Bloomberg) -- Masimo Corp. Chief Executive Officer Joe Kiani, head of the 
medical device maker that has put Apple Inc.'s smartwatch on the...","Dec 19, 2023",Yahoo Finance
https://www.bloomberg.com/news/articles/2024-02-05/forgot-your-apple-vision-pro-s-passcode-you-may-have-to-take-it-back-to-store,Apple (AAPL) Vision Pro Users Have to Send It Back If Passcode Is Lost,"Buyers of Apple Inc.'s new Vision Pro headset are finding it can be a major 
hassle if they lose their passcode.",4 weeks ago,Bloomberg.com
https://news.bloomberglaw.com/ip-law/vidal-vacates-patent-privity-ruling-boosting-apple-samsung,"Vidal Vacates Patent Privity Ruling, Boosting Apple, Samsung","Apple Inc.'s and Samsung Electronics Co.'s administrative challenges to a 
patent underlying suits against them got a boost after US Patent...","May 23, 2023",Bloomberg Law News
https://fortune.com/2023/04/17/how-much-will-apple-spend-on-stock-buybacks-earnings-90-billion/,"Wall Street wants to know whether Apple the buyback king will continue to 
plow $90 billion into stock buybacks—or go higher","One of the most important numbers in Apple Inc.'s upcoming earnings report 
has nothing to do with iPhones or Mac computers.","Apr 17, 2023",Fortune
https://www.proactiveinvestors.com/companies/news/1025013/apple-inc-s-wonderlust-a-desired-date-for-iphone-15-launch-analysts-1025013.html,Apple Inc's Wonderlust a desired date for iPhone 15 launch: analysts,"BofA Securities analysts expect Apple Inc (NASDAQ:AAPL) to launch the 
iPhone 15 on September 12, 2023, at its Wonderlust event,...","Aug 30, 2023",Proactive financial news
https://www.livemint.com/technology/tech-news/apple-inc-s-personal-computer-shipments-declined-by-40-5-in-the-first-quarter-11681102761696.html,"Apple Inc.’s personal computer shipments declined by 40.5% in the first 
quarter | Mint","Apple Inc.'s personal computer shipments declined by 40.5% in the first 
quarter, marking a tough start to the year for PC makers still...","Apr 10, 2023",mint
https://finance.yahoo.com/news/apples-lesser-known-co-founder-180031182.html,"Apple's Lesser-Known Co-Founder Owned ⅓ Of The Company But Missed Out On A 
Potential $900 Billion Fortune","With the late Steve Jobs and Steve Wozniak, Apple Inc.'s co-founders, 
dominating the tech world for decades, it's easy to overlook the vital...","Aug 21, 2023",Yahoo Finance
https://www.bloomberg.com/news/articles/2023-12-13/apple-set-to-be-hit-by-eu-antitrust-order-in-app-store-fight-with-spotify,Apple Set to Be Hit by EU Antitrust Order in App Store Fight With Spotify,"Apple Inc. faces a potentially hefty fine as well as a ban on App Store 
rules it allegedly used to thwart music-streaming rivals, in the...","Dec 13, 2023",Bloomberg
https://www.bloomberg.com/news/articles/2023-11-16/apple-project-to-replace-modems-made-by-qualcomm-falls-further-behind-to-2026,"Apple Project to Replace Modems Made by Qualcomm Falls Further Behind to 
2026","Company will likely miss a 2025 goal to roll out its own cellular modem 
inside the device.","Nov 16, 2023",Bloomberg
https://www.bloomberg.com/news/articles/2023-09-22/iphone-15-release-uk-how-to-save-money-find-best-deal,iPhone 15 Released: Cheapest Deals and Offers,"Apple Inc.'s latest iPhone went on sale Friday, drawing strong initial 
interest from buyers with sold-out pre-orders for some models and...","Sep 22, 2023",Bloomberg.com
https://www.business-standard.com/world-news/apple-inc-considered-switching-to-search-engine-duckduckgo-from-google-123100500094_1.html,Apple Inc considered switching to search engine DuckDuckGo from Google,"By Leah Nylen. Apple Inc. held talks with DuckDuckGo to replace Alphabet 
Inc.'s Google as the default search engine for the private mode on...","Oct 5, 2023",Business Standard
