link,title,snippet,date,source
https://www.thestreet.com/electric-vehicles/elon-musk-is-threatening-to-leave-delaware-heres-why-tesla-is-there-in-the-first-place,"Elon Musk is threatening to leave Delaware; here's why Tesla is there in 
the first place","Tesla, and more than a million other corporations, are incorporated in the 
First State.",1 month ago,TheStreet
https://www.bloomberg.com/news/articles/2023-09-01/tesla-model-x-price-cut-by-41-000-to-enable-subsidy-musk-didn-t-want,"Tesla Model X Price Cut By $41,000 to Enable Subsidy Musk Didn’t Want","Tesla Inc.'s latest discounts will newly qualify one of its models for 
federal subsidies that Elon Musk said years ago the US should scrap.","Sep 1, 2023",Bloomberg
https://www.expressnews.com/business/article/tesla-mexico-nuevo-leon-plant-second-guessing-18556503.php,"Musk's stalling leads Mexico to second-guess massive Tesla factory in Nuevo 
Leon","There's a huge void in the northern Mexico desert where Elon Musk said 
early this year Tesla Inc. would build its next massive car plant.","Dec 15, 2023",San Antonio Express-News
https://cars.usnews.com/cars-trucks/advice/how-fast-is-a-tesla,How Fast Is A Tesla? | U.S. News,"The Model S is Tesla's flagship model, and it was the first to get the 
Spaceballs-inspired Plaid treatment. The standard Model S's dual-motor...","Nov 8, 2023",U.S. News & World Report
https://fortune.com/2023/09/01/tesla-drops-model-x-price-to-qualify-for-incentives-elon-musk-opposed/,"Tesla drops Model X price to qualify for federal incentives that Elon Musk 
once opposed: ‘I’m literally saying, get rid of all subsidies’","Tesla Inc.'s latest discounts will newly qualify one of its models for 
federal subsidies that Elon Musk said years ago the US should scrap.","Sep 1, 2023",Fortune
https://finance.yahoo.com/news/whats-driving-tesla-incs-surprising-162021117.html,What's Driving Tesla Inc's Surprising 29% Stock Rally?,"Tesla Inc (NASDAQ:TSLA), a leading player in the Vehicles & Parts industry, 
has seen a significant surge in its stock price over the past...","Aug 29, 2023",Yahoo Finance
https://www.cnn.com/markets/stocks/TSLA,TSLA Stock Quote Price and Forecast,"View Tesla, Inc. TSLA stock quote prices, financial information, real-time 
forecasts, and company news from CNN.","Aug 30, 2023",CNN
https://www.bloomberg.com/news/articles/2023-12-07/tesla-s-dojo-super-computer-head-exits-in-blow-to-efforts,Tesla's Dojo Supercomputer Head Exits in Blow to Efforts,"Tesla Inc.'s Dojo supercomputer project lead Ganesh Venkataramanan has left 
the company, according to people familiar with the matter,...","Dec 7, 2023",Bloomberg
https://www.bloomberg.com/news/articles/2023-08-08/blink-charging-ceo-says-switch-to-tesla-plugs-will-help-company,Blink Charging (BLNK) to Benefit From Adoption of Tesla Electric-Car Plugs,"The auto industry's rapid shift to using Tesla Inc.'s charging standard for 
other electric cars will benefit Blink Charging Co.,...","Aug 8, 2023",Bloomberg
https://www.bloomberg.com/news/articles/2023-11-13/india-weighs-five-year-tax-cuts-on-ev-imports-to-woo-tesla,Indian Minister Visits Tesla Plant as EV Tax Cuts Being Mulled,"India's trade minister hailed Tesla Inc.'s ties with the South Asian nation 
during a tour of one of the company's US plants as the...","Nov 14, 2023",Bloomberg
https://businessmodelanalyst.com/tesla-mission-and-vision-statement/,Tesla Mission and Vision Statement,"The Tesla mission statement is “to accelerate the world's transition to 
sustainable energy.” And the Tesla vision statement is “to create...","May 22, 2023",Business Model Analyst
https://www.cnbc.com/2024/01/30/tesla-shares-slide-after-judge-voids-elon-musks-56-billion-compensation.html,"Elon Musk's $56 billion Tesla compensation voided by judge, shares slide","The compensation package the Tesla board gave CEO Elon Musk set a record 
for publicly traded corporations, a Delaware judge noted in her...",1 month ago,CNBC
https://fortune.com/europe/2023/12/07/elon-musk-sweden-labor-union-tesla-court-pension-fund/,"Elon Musk’s showdown with Nordic labor deepens as a pension fund dumps 
Tesla shares and postal workers withhold mail","Elon Musk is facing a deepening crisis in the Nordic region after Tesla 
Inc. suffered a fresh legal setback over a labor dispute that's also...","Dec 7, 2023",Fortune
https://cars.usnews.com/cars-trucks/advice/lucid-air-vs-tesla-model-s,Lucid Air vs. Tesla Model S: Head-to-Head | U.S. News,"The Tesla Model S and Lucid Air are at the pinnacle of luxury EV sedans, 
but which is better?","Nov 8, 2023",U.S. News & World Report
https://uk.investing.com/news/stock-market-news/tesla-under-fire-again-in-germany-as-local-authorities-accuse-ev-giant-of-polluting-berlins-drinking-water-supply-3359557,"Tesla Under Fire Again In Germany As Local Authorities Accuse EV Giant Of 
Polluting Berlin's Drinking Water Supply ...","Benzinga - by Anan Ashraf, Benzinga Editor. A local water authority near 
Tesla Inc's (NASDAQ:TSLA) German gigafactory has reportedly accused...",2 days ago,Investing.com UK
https://www.mentalfloss.com/article/66675/10-things-you-may-not-know-about-tesla-motors,"10 Things You May Not Know About Tesla, Inc.","Since the introduction of the Tesla Roadster in 2008, fans of performance 
and green technology have flocked to Tesla Motors' electric cars.","Aug 8, 2023",Mental Floss
https://news.bloomberglaw.com/litigation/teslas-direct-ev-sales-model-wins-delaware-top-court-reprieve,Tesla's Direct EV Sales Model Wins Delaware Top Court Reprieve,"Tesla Inc.'s direct-to-consumer electric vehicle sales model doesn't 
violate a Delaware law prohibiting manufacturers from owning interests...","May 15, 2023",Bloomberg Law News
https://finance.yahoo.com/news/tesla-considering-25-billion-bet-170113683.html,Tesla Is Considering A $25 Billion Bet On The Indian Electric Vehicle Market,"Tesla Inc. is considering an investment proposal with the Indian government 
that would see the company open a factory with the capacity to...","Jul 17, 2023",Yahoo Finance
https://www.bloomberg.com/opinion/articles/2023-07-20/tesla-s-market-cap-rises-the-more-its-margins-fall,Tesla's Market Cap Rises the More Its Margins Fall,"Tesla Inc.'s latest results gave bulls a lot of what they wanted: An 
earnings beat, tantalizing shots of the Cybertruck and an “internal...","Jul 19, 2023",Bloomberg
https://www.nytimes.com/2023/06/08/business/general-motors-tesla-electric-vehicles-charging.html,GM’s Electric Vehicles Will Use Tesla’s Charging Network,"The electric car company, which operates the country's most extensive 
charging network, struck a similar deal with Ford Motor recently.","Jun 8, 2023",The New York Times
https://www.cnbc.com/2023/07/27/tesla-created-secret-team-to-suppress-thousands-of-driving-range-complaints.html,Tesla created secret team to suppress thousands of driving range complaints,"Years ago, Tesla rigged dashboard readouts to show optimistic driving range 
projections. Last year, it formed a special team to cancel...","Jul 27, 2023",CNBC
https://www.livemint.com/auto-news/bad-news-for-elon-musks-tesla-indian-govt-says-no-plans-for-providing-exemption-or-subsidy-on-ev-imports-11702534780566.html,"Bad news for Elon Musk's Tesla? Indian govt says no plans for providing 
exemption or subsidy on EV imports | Mint","India's government said it's not currently considering reducing taxes on 
imported electric vehicles, a stance that could delay Tesla Inc.'s...","Dec 14, 2023",mint
https://time.com/6336614/tesla-and-x-face-advertiser-and-investor-fallout-over-elon-musks-controversial-post/,Fallout Spreads Over Elon Musk's Latest Controversial X Post,"Musk's apparent endorsement of antisemitic views has prompted outrage from 
advertisers and investors in his various businesses, including X...","Nov 16, 2023",Time Magazine
https://www.livemint.com/auto-news/elon-musks-tesla-plans-to-invest-up-to-2-billion-in-indias-plant-but-with-riders-11700793323434.html,"Elon Musk's Tesla plans to invest up to $2 billion in India's plant but 
with riders | Mint","Elon Musk's Tesla Inc is willing to set up a factory of the posh electric 
cars in India only if the government approves a concessional duty...","Nov 24, 2023",mint
https://www.teslarati.com/indonesia-minister-hopes-tesla-plant-still-on-the-table/,Indonesia Minister hopeful that Tesla plant still on the table: report,"Despite reports that Elon Musk decided to use Malaysia as Tesla Inc.'s 
Southeast Asian base, Indonesia's Minister of Maritime Affairs and...","Aug 10, 2023",Teslarati
