link,title,snippet,date,source
https://www.expressnews.com/business/article/tesla-mexico-nuevo-leon-plant-second-guessing-18556503.php,"Musk's stalling leads Mexico to second-guess massive Tesla factory in Nuevo 
Leon","There's a huge void in the northern Mexico desert where Elon Musk said 
early this year Tesla Inc. would build its next massive car plant.","Dec 15, 2023",San Antonio Express-News
https://cars.usnews.com/cars-trucks/advice/how-fast-is-a-tesla,How Fast Is A Tesla? | U.S. News,"The Model S is Tesla's flagship model, and it was the first to get the 
Spaceballs-inspired Plaid treatment. The standard Model S's dual-motor...","Nov 8, 2023",U.S. News & World Report
https://ktvz.com/money/cnn-business-consumer/2024/02/02/tesla-recalling-another-2-2-million-vehicles-for-warning-lights-that-are-too-small/,"Tesla recalling another 2.2 million vehicles for warning lights that are 
too small","New York (CNN) — Tesla is recalling 2.2 million of its vehicles on US roads 
because the font size of the warning lights on its display is...",1 month ago,KTVZ
https://news.bloomberglaw.com/esg/elon-musks-glass-house-leads-to-lawsuit-by-tesla-shareholder,Elon Musk's Glass House Leads to Tesla Shareholder Lawsuit (1),"An investor is suing Tesla Inc. over concerns that Elon Musk may have spent 
years devoting company funds to personal perks,...","Dec 11, 2023",Bloomberg Law News
https://fortune.com/2023/09/01/tesla-drops-model-x-price-to-qualify-for-incentives-elon-musk-opposed/,"Tesla drops Model X price to qualify for federal incentives that Elon Musk 
once opposed: ‘I’m literally saying, get rid of all subsidies’","Tesla Inc.'s latest discounts will newly qualify one of its models for 
federal subsidies that Elon Musk said years ago the US should scrap.","Sep 1, 2023",Fortune
https://www.washingtonpost.com/business/2023/07/19/tesla-s-market-cap-rises-the-more-its-margins-fall/2c16c260-2698-11ee-9201-826e5bb78fa1_story.html,Analysis | Tesla's Market Cap Rises the More Its Margins Fall,"Tesla Inc.'s latest results gave bulls a lot of what they wanted: An 
earnings beat, tantalizing shots of the Cybertruck and an “internal...","Jul 19, 2023",The Washington Post
https://www.cnn.com/markets/stocks/TSLA,TSLA Stock Quote Price and Forecast,"View Tesla, Inc. TSLA stock quote prices, financial information, real-time 
forecasts, and company news from CNN.","Aug 30, 2023",CNN
https://www.bloomberg.com/news/articles/2023-12-07/tesla-s-dojo-super-computer-head-exits-in-blow-to-efforts,Tesla's Dojo Supercomputer Head Exits in Blow to Efforts,"Tesla Inc.'s Dojo supercomputer project lead Ganesh Venkataramanan has left 
the company, according to people familiar with the matter,...","Dec 7, 2023",Bloomberg
https://fortune.com/europe/2023/07/24/tesla-lapping-german-automakers-global-ev-race-even-in-germany/,Tesla is lapping German automakers in the global EV race—even in Germany,"Germany's automakers announced bold plans the last several years to shift 
to electric cars and challenge Tesla Inc.'s dominance.","Jul 24, 2023",Fortune
https://www.bloomberg.com/news/articles/2023-11-13/india-weighs-five-year-tax-cuts-on-ev-imports-to-woo-tesla,Indian Minister Visits Tesla Plant as EV Tax Cuts Being Mulled,"India's trade minister hailed Tesla Inc.'s ties with the South Asian nation 
during a tour of one of the company's US plants as the...","Nov 14, 2023",Bloomberg
https://www.morningstar.com/news/marketwatch/20231222232/teslas-stock-can-rise-to-1-trillion-market-value-in-2024-analyst-says,"Tesla's stock can rise to $1 trillion market value in 2024, analyst says","By Tomi Kilgore. Wedbush's Dan Ives boosts price target on Tesla's stock to 
$350, sees further EV share gains. Tesla Inc. is poised to join...","Dec 22, 2023",Morningstar
https://businessmodelanalyst.com/tesla-mission-and-vision-statement/,Tesla Mission and Vision Statement,"The Tesla mission statement is “to accelerate the world's transition to 
sustainable energy.” And the Tesla vision statement is “to create...","May 22, 2023",Business Model Analyst
https://www.cnbc.com/2024/01/30/tesla-shares-slide-after-judge-voids-elon-musks-56-billion-compensation.html,"Elon Musk's $56 billion Tesla compensation voided by judge, shares slide","The compensation package the Tesla board gave CEO Elon Musk set a record 
for publicly traded corporations, a Delaware judge noted in her...",1 month ago,CNBC
https://www.thecarconnection.com/cars/tesla_model-s,"2024 Tesla Model S Review: Prices, Specs, and Photos","Read our expert review of the 2024 Tesla Model S, and learn more about 
prices, specs and features, or compare similar cars to find the best...",4 weeks ago,The Car Connection
https://cars.usnews.com/cars-trucks/advice/lucid-air-vs-tesla-model-s,Lucid Air vs. Tesla Model S: Head-to-Head | U.S. News,"The Tesla Model S and Lucid Air are at the pinnacle of luxury EV sedans, 
but which is better?","Nov 8, 2023",U.S. News & World Report
https://www.greencarreports.com/news/1140501_tesla-drops-prices-model-s-model-x-standard-range,"Tesla drops Model S, Model X base price with Standard Range versions","Tesla's latest price adjustment teases a lower price for the Model X and 
Model S, with reduced driving range—albeit a larger battery with...","Aug 15, 2023",Green Car Reports
https://www.bloomberg.com/news/articles/2023-11-22/tesla-driver-s-family-can-seek-punitive-damages-over-fatal-crash,Tesla Driver's Family Can Seek Punitive Damages Over Fatal Crash,"Tesla Inc.'s trial over a 2019 fatal crash blamed on Autopilot will include 
a claim against the company for punitive damages,...","Nov 21, 2023",Bloomberg
https://uk.investing.com/news/stock-market-news/tesla-under-fire-again-in-germany-as-local-authorities-accuse-ev-giant-of-polluting-berlins-drinking-water-supply-3359557,"Tesla Under Fire Again In Germany As Local Authorities Accuse EV Giant Of 
Polluting Berlin's Drinking Water Supply ...","Benzinga - by Anan Ashraf, Benzinga Editor. A local water authority near 
Tesla Inc's (NASDAQ:TSLA) German gigafactory has reportedly accused...",2 days ago,Investing.com UK
https://www.mentalfloss.com/article/66675/10-things-you-may-not-know-about-tesla-motors,"10 Things You May Not Know About Tesla, Inc.","Since the introduction of the Tesla Roadster in 2008, fans of performance 
and green technology have flocked to Tesla Motors' electric cars.","Aug 8, 2023",Mental Floss
https://finance.yahoo.com/news/battery-crushes-teslas-tech-unveils-160816090.html,"New Battery Crushes Tesla's Tech, Unveils A Solid-State Marvel With 300% 
Higher Energy Density, 15-Minute Ultra ...","In the rapidly evolving landscape of electric vehicle (EV) technology, a 
new player is emerging as a formidable challenger to Tesla Inc.'s...","Nov 28, 2023",Yahoo Finance
https://news.bloomberglaw.com/litigation/tesla-leaders-free-for-now-of-shareholder-toxic-workplace-suit,Tesla Leaders Free for Now of Shareholder 'Toxic Workplace' Suit,"Tesla Inc. investors can't proceed with a lawsuit against CEO Elon Musk and 
other directors and officers alleging they fostered a “toxic...","Sep 19, 2023",Bloomberg Law News
https://www.zenger.news/2023/11/27/elon-musk-reacts-as-teslas-iphone-moment-plays-out-with-fans-queuing-up-to-catch-glimpse-of-cybertruck-in-showrooms-ahead-of-launch/,"Elon Musk Reacts As Tesla's 'iPhone Moment' Plays Out With Fans Queuing Up 
To Catch Glimpse Of Cybertruck In ...","Tesla, Inc.'s (NASDAQ:TSLA) Cybertruck launch is just four days away, and 
the electric pickup truck from the company's stable appears to be...","Nov 27, 2023",Zenger News
https://www.wsj.com/articles/tesla-tsla-q1-earnings-report-2023-6b441d30,Tesla Earnings: Profit Drops 24% After Price Cuts,"Several rounds of reductions in the first months of the year weighed on 
Tesla's first-quarter results.","Apr 19, 2023",WSJ
https://www.npr.org/2024/02/02/1228607494/tesla-recall-warning-lights-software-update,Tesla recalls nearly 2.2M vehicles for software update to fix warning lights,"Tesla is recalling nearly all of the autos it's sold in the U.S. because 
some warning lights on the instrument panel are too small.",1 month ago,NPR
