link,title,snippet,date,source
https://time.com/6836236/tesla-racism-lawsuit-black-workers-california/,"Thousands of Black Workers Can Sue Tesla for Racism, Judge Rules","Almost 6,000 Black workers from Tesla Inc.'s California factory can sue the 
car maker collectively over claims that it failed to protect...",2 days ago,Time Magazine
https://www.expressnews.com/business/article/tesla-mexico-gigafactory-construction-start-march-18680134.php,"Tesla could break ground on big EV factory near Monterrey, Mexico, in March","Tesla Inc. could break ground on its new factory in Mexico as soon as next 
month, the governor of Nuevo León said last week.",1 week ago,San Antonio Express-News
https://www.detroitnews.com/story/business/autos/2024/02/28/apple-move-to-quit-car-program-a-reprieve-for-detroit-three-tesla/72772709007/,"Apple's move to quit car program offers a reprieve to Detroit Three, Tesla","The sudden demise of Apple Inc.'s car program is a bleak sign for the 
electric-vehicle market. It's also a welcome boon for automakers.",3 days ago,The Detroit News
https://www.msn.com/en-us/money/news/tesla-analyst-believes-megapack-is-a-120b-sleeping-giant-that-could-surpass-ev-business-flags-next-big-catalyst-for-stock/ar-BB1j9pUc,"Tesla Analyst Believes Megapack Is A $120B Sleeping Giant That Could 
Surpass EV Business, Flags Next Big Catalyst ...","As Tesla, Inc.'s (NASDAQ:TSLA) core electric vehicle business faces 
challenges, sell-side analysts are shifting their focus to the company's 
ancillary...",1 day ago,MSN
https://finance.yahoo.com/news/teslas-supercharger-network-continues-secure-153125077.html,"Tesla's Supercharger Network Continues to Secure Partnerships, But 
Competition Is Coming","It's no secret that Tesla Inc. is the cream of the electric vehicle (EV) 
industry crop. And that doesn't just hold true with its vehicles.",1 day ago,Yahoo Finance
https://www.marketbeat.com/instant-alerts/nasdaq-tsla-sec-filing-2024-02-25/,"Tesla, Inc. (NASDAQ:TSLA) is O Neil Global Advisors Inc.'s 2nd Largest 
Position","O Neil Global Advisors Inc. lowered its stake in Tesla, Inc. (NASDAQ:TSLA - 
Free Report) by 79.1% in the 3rd quarter, according to its most...",6 days ago,MarketBeat
https://financialpost.com/commodities/energy/electric-vehicles/tesla-factory-mexico-chinese-suppliers-us-fears,"Tesla factory in Mexico taps Chinese suppliers, stoking U.S. fears","Chinese auto-parts makers are rapidly setting up plants to supply Tesla 
Inc.'s next factory in Mexico. Find out more.",2 weeks ago,Financial Post
https://www.suredividend.com/tesla-dividend/,Will Tesla Ever Pay A Dividend?,"Updated on February 21st, 2024. The appeal of growth stocks is that they 
have the potential for huge returns. Consider the massive rally by Tesla, 
Inc.",1 week ago,Sure Dividend
https://www.scmp.com/news/world/united-states-canada/article/3253879/elon-musk-sues-openai-and-ceo-sam-altman-abandoning-mission,Elon Musk sues OpenAI and CEO Sam Altman for abandoning mission,"Musk's lawsuit claims ChatGPT-maker OpenAI and its chief executive Sam 
Altman, among others, abandoned the company's original mission to...",1 day ago,South China Morning Post
https://www.tradingview.com/news/benzinga:c1b970dc2094b:0-ford-ceo-thanks-tesla-for-changing-ev-customer-lives-rolls-out-supercharging-network-access/,"Ford CEO Thanks Tesla For 'Changing EV Customer Lives,' Rolls Out 
Supercharging Network Access","Ford Motor Company NYSE:F is officially allowing its electric vehicle (EV) 
customers access to Tesla Inc's NASDAQ:TSLA vast Supercharger...",2 days ago,www.tradingview.com
https://www.statista.com/topics/2086/tesla/,Tesla - statistics & facts,"Tesla is the leading producer of plug-in electric vehicles globally. Its 
Model 3 has become the world's best-selling all-electric vehicle...",1 month ago,Statista
https://money.usnews.com/investing/stock-market-news/slideshows/upstart-tesla-competitors-to-watch,Tesla Competitors: 7 Rival EV Stocks to Buy | Investing | U.S. News,"Electric vehicles will account for about 35% of all global new car sales by 
2030, according to projections by Goldman Sachs. Tesla Inc.",3 weeks ago,US News Money
https://rivcoda.org/news/das-office-announces-settlement-tesla-improper-disposal-hazardous-waste,"DA's Office announces settlement with Tesla for improper disposal of 
hazardous waste | Riverside County District ...","RIVERSIDE – District Attorney Mike Hestrin, along with 24 other District 
Attorneys throughout California, announced that today a judge in...",1 month ago,Riverside County District Attorney
https://finance.yahoo.com/news/tesla-inc-tsla-attracting-investor-140009840.html,"Tesla, Inc. (TSLA) is Attracting Investor Attention: Here is What You 
Should Know","Tesla (TSLA) has been one of the stocks most watched by Zacks.com users 
lately. So, it is worth exploring what lies ahead for the stock.",1 week ago,Yahoo Finance
https://finance.yahoo.com/news/director-robyn-denholm-sells-93-081038324.html,"Director Robyn Denholm Sells 93,706 Shares of Tesla Inc (TSLA)","Robyn Denholm, a director at Tesla Inc (NASDAQ:TSLA), sold 93706 shares of 
the company on February 21, 2024, according to a recent SEC...",1 week ago,Yahoo Finance
https://finance.yahoo.com/news/tesla-inc-tsla-trending-stock-140010134.html,"Tesla, Inc. (TSLA) Is a Trending Stock: Facts to Know Before Betting on It","Tesla (TSLA) has been one of the stocks most watched by Zacks.com users 
lately. So, it is worth exploring what lies ahead for the stock.",3 weeks ago,Yahoo Finance
https://finance.yahoo.com/news/tesla-inc-nasdaq-tsla-fundamentals-120016559.html,"Tesla, Inc.'s (NASDAQ:TSLA) Fundamentals Look Pretty Strong: Could The 
Market Be Wrong About The Stock?","A Side By Side comparison of Tesla's Earnings Growth And 20% ROE. At first 
glance, Tesla seems to have a decent ROE. Further, the company's ROE...","Nov 8, 2023",Yahoo Finance
https://finance.yahoo.com/news/tesla-inc-nasdaq-tsla-fundamentals-140018931.html,"Tesla, Inc.'s (NASDAQ:TSLA) Fundamentals Look Pretty Strong: Could The 
Market Be Wrong About The Stock?","Tesla's Earnings Growth And 23% ROE. To begin with, Tesla has a pretty high 
ROE which is interesting. Secondly, even when compared to the...","Oct 2, 2023",Yahoo Finance
https://finance.yahoo.com/news/elon-musk-almost-sold-tesla-151121693.html,"Elon Musk Almost Sold Tesla To Google for $11 Billion — But He Called The 
Deal Off When He 'No Longer Needed A ...","The story of Tesla Inc.'s brush with bankruptcy in 2013 and its subsequent 
rescue efforts by Elon Musk is detailed in Ashlee Vance's...",3 weeks ago,Yahoo Finance
https://finance.yahoo.com/news/tesla-inc-nasdaq-tsla-recent-130019289.html,"Tesla, Inc.'s (NASDAQ:TSLA) recent 3.5% pullback adds to one-year year 
losses, institutional owners may take drastic ...","If you want to know who really controls Tesla, Inc. (NASDAQ:TSLA), then 
you'll have to look at the makeup of its share registry. With 43% stake,...","Oct 26, 2023",Yahoo Finance
https://finance.yahoo.com/news/tesla-inc-nasdaq-tsla-stock-120024894.html,"Tesla, Inc.'s (NASDAQ:TSLA) Stock Is Going Strong: Is the Market Following 
Fundamentals?","Tesla's Earnings Growth And 23% ROE. To begin with, Tesla has a pretty high 
ROE which is interesting. Additionally, the company's ROE is higher...","Sep 1, 2023",Yahoo Finance
https://www.theglobeandmail.com/drive/mobility/article-ford-begins-rolling-out-access-to-tesla-supercharger-network-to-its-ev/,"Ford begins rolling out access to Tesla Supercharger network to its EV 
owners","The network is open to Mustang Mach-E and F-150 Lightning owners in Canada 
and the United States.",2 days ago,The Globe and Mail
https://www.marketbeat.com/instant-alerts/nasdaq-tsla-sec-filing-2024-02-20/,"Tesla, Inc. (NASDAQ:TSLA) is Continental Investors Services Inc.'s Largest 
Position","Continental Investors Services Inc. lessened its holdings in shares of 
Tesla, Inc. (NASDAQ:TSLA - Free Report) by 51.4% during the third...",1 week ago,MarketBeat
https://financialpost.com/investing/apple-electric-vehicle-wind-down-reprieve-tesla-detroit-rivals,"Apple's electric-vehicle wind down offers reprieve to Tesla, Detroit rivals","The sudden demise of Apple Inc.'s electric-vehicle program is a bleak sign 
for the car market. It's also a welcome boon for automakers...",3 days ago,Financial Post
https://www.bloomberg.com/news/articles/2024-01-02/tesla-is-losing-out-to-a-chinese-ev-maker-what-does-that-mean-for-musk,Tesla Is Losing Out to a Chinese EV Maker,"On this episode of the Elon, Inc. podcast, we explain what BYD's ascent 
means for the industry and Musk. Also, X takes another hit.","Jan 2, 2024",Bloomberg
https://www.statista.com/statistics/715421/tesla-quarterly-vehicle-production/,Tesla production by quarter YTD 2023,"Tesla Inc.'s most recent quarterly vehicle production volume came to 
430,500 units. Tesla's production level in the third quarter of 2023...","Oct 16, 2023",Statista
https://www.morningstar.com/news/marketwatch/20240112295/cathie-wood-buys-more-tesla-stock-on-a-dip-and-keeps-on-cutting-her-coinbase-stake,"Cathie Wood buys more Tesla stock on a dip and keeps on cutting her 
Coinbase stake","By Tomi Kilgore. Wood's flagship ARK Innovation ETF has bought more than 
$20 million worth of Tesla's stock three times in three weeks,...",1 month ago,Morningstar
https://fortune.com/europe/2024/02/22/mercedes-ceo-warns-cost-parity-evs-traditional-ice-cars-many-years-away-slower-demand/,"Mercedes CEO warns that EVs are ‘many years away’ from costing the same as 
traditional cars amid cooling demand for vehicles with a plug","Mercedes and its peers have grown more cautious about battery technology as 
sales of EVs this year are set to grow at the slowest rate since...",1 week ago,Fortune
https://www.opb.org/article/2024/01/03/china-s-byd-is-rivaling-tesla-in-size-can-it-also-match-its-global-reach/,China’s BYD is rivaling Tesla in size. Can it also match its global reach?,"A less flashy Chinese electric vehicle maker is fast closing the gap with 
Tesla, the longtime, market-leading pioneer. FILE - A model stands...","Jan 3, 2024",Oregon Public Broadcasting - OPB
https://fortune.com/2023/12/30/tesla-won-over-electric-vehicles-fans-now-elon-musk-automaker-must-convince-everyday-car-buyers/,"Tesla won over fans of electric vehicles. Now Elon Musk and company have a 
bigger challenge: convincing everyday car buyers","Tesla Inc. is expected to say on Tuesday it had another record delivery 
year in 2023, in large part due to die-hard Elon Musk fans and...","Dec 30, 2023",Fortune
https://finance.yahoo.com/news/tesla-surge-thanks-dojo-supercomputer-032644640.html,Morgan Stanley Sees Dojo Boosting Tesla's Value by $500 Billion,"(Bloomberg) -- Tesla Inc.'s Dojo supercomputer may add as much as $500 
billion to the company's market value through faster adoption of...","Sep 11, 2023",Yahoo Finance
https://finance.yahoo.com/news/tesla-inc-nasdaq-tsla-latest-140022708.html,"Is Tesla, Inc.'s (NASDAQ:TSLA) Latest Stock Performance A Reflection Of Its 
Financial Health?","Tesla's Earnings Growth And 24% ROE. Firstly, we acknowledge that Tesla has 
a significantly high ROE. Secondly, even when compared to the...","Jul 1, 2023",Yahoo Finance
https://finance.yahoo.com/news/investors-heavily-search-tesla-inc-130011165.html,"Investors Heavily Search Tesla, Inc. (TSLA): Here is What You Need to Know","Tesla is expected to post earnings of $0.76 per share for the current 
quarter, representing a year-over-year change of -36.1%. Over the last 30...","Nov 3, 2023",Yahoo Finance
https://www.bloomberg.com/news/articles/2023-10-27/tesla-tsla-ev-investors-face-a-reckoning-as-demand-starts-to-crack,"Tesla (TSLA), Electric Car Investors Face Reckoning as Demand Starts to 
Crack","The electric-vehicle boom that spawned multibillion dollar startups 
overnight and pushed Tesla Inc.'s value into the stratosphere is...","Oct 27, 2023",Bloomberg
https://finance.yahoo.com/news/teslas-tsla-ev-market-share-095200357.html,Tesla's (TSLA) EV Market Share Comes Down to 50% in Q3,"Tesla, Inc.'s TSLA market share in the U.S. electric vehicles (EV) segment 
has come down to 50% in third-quarter 2023 from a much-vaunted...","Oct 13, 2023",Yahoo Finance
https://uk.investing.com/news/stock-market-news/tesla-bucks-trend-with-premarket-gains-wednesday-whats-going-on-3357626,"Tesla Bucks Trend With Premarket Gains Wednesday: What's Going On By 
Benzinga","Benzinga - by Shanthi Rexaline, Benzinga Editor. Tesla, Inc. (NASDAQ:TSLA) 
shares rose in premarket trading on Wednesday even as stock...",3 days ago,Investing.com UK
https://www.bloomberg.com/news/articles/2023-12-14/tesla-s-nordic-dispute-sparks-angry-letter-from-money-managers,Tesla's Nordic Dispute Sparks Angry Letter From Money Managers,"Tesla Inc.'s showdown with trade unions across the Nordic region is 
threatening to spill over to the financial markets after a group of...","Dec 14, 2023",Bloomberg
https://finance.yahoo.com/news/tesla-inc-nasdaq-tsla-favorite-110100646.html,"Tesla, Inc. (NASDAQ:TSLA) is a favorite amongst institutional investors who 
own 44%","We can see that Tesla does have institutional investors; and they hold a 
good portion of the company's stock. This can indicate that the company...","Nov 26, 2023",Yahoo Finance
https://finance.yahoo.com/news/tesla-inc-tsla-trending-stock-140017414.html,"Tesla, Inc. (TSLA) Is a Trending Stock: Facts to Know Before Betting on It","Over the past month, shares of this electric car maker have returned 
-13.7%, compared to the Zacks S&P 500 composite's +3.1% change. During 
this...",1 month ago,Yahoo Finance
https://www.morningstar.com/news/marketwatch/20240206766/ford-says-that-it-will-launch-a-tesla-model-2-rival-calls-for-strong-year,"Ford says that it will launch a Tesla 'Model 2' rival, calls for 'strong' 
year","By Claudia Assis. Ford easily tops revenue, adjusted EPS expectations. Ford 
Motor Co.'s stock soared more than 6% in the extended session...",3 weeks ago,Morningstar
https://finance.yahoo.com/news/insider-sell-alert-tesla-inc-160432840.html,"Insider Sell Alert: Tesla Inc CFO Vaibhav Taneja Sells 4,000 Shares","Tesla Inc (NASDAQ:TSLA), the renowned electric vehicle and clean energy 
company, has recently witnessed a significant insider sell by its...","Dec 2, 2023",Yahoo Finance
https://www.bloomberg.com/news/articles/2024-01-25/tesla-tsla-loses-its-luster-as-weight-loss-drugmaker-lilly-lly-overtakes,Tesla (TSLA) Loses Its Luster as Weight Loss Drugmaker Lilly (LLY) Overtakes,"Weight-loss drug innovators have unseated electric-car makers as some of 
2024's must-own stocks. Tesla Inc.'s $80 billion wipeout,...",1 month ago,Bloomberg.com
https://fortune.com/2024/01/16/elon-musk-25-voting-control-tesla-owning-12-company-ai-startups-dojo/,"Musk wants 25% voting control of Tesla despite only owning 12% of company: 
‘Unless that is the case, I would prefer to build products outside of Tesla’","Elon Musk leaned on Tesla Inc.'s board to arrange another massive 
performance award for him after he sold a significant chunk of his stake...",1 month ago,Fortune
https://stocknews.com/news/tsla-hmc-isuzy-stla-tesla-inc-tsla-stock-analysis-buy-signals-for-this-week/,"TSLA: Tesla, Inc. (TSLA) Stock Analysis: Buy Signals for This Week?","Tesla, Inc.(NASDAQ:TSLA): EV market behemoth Tesla (TSLA) missed its 
delivery estimates in the third quarter. Is it still a buy for this...","Oct 12, 2023",StockNews.com
https://finance.yahoo.com/news/wake-tesla-inc-nasdaq-tsla-140021690.html,"In the wake of Tesla, Inc.'s (NASDAQ:TSLA) latest US$106b market cap drop, 
institutional owners may be forced to take ...","If you want to know who really controls Tesla, Inc. (NASDAQ:TSLA), then 
you'll have to look at the makeup of its share registry. The group...","Jun 27, 2023",Yahoo Finance
https://finance.yahoo.com/news/losing-10-past-tesla-inc-140028764.html,"After losing 10% in the past year, Tesla, Inc. (NASDAQ:TSLA) institutional 
owners must be relieved by the recent gain","Key Insights Given the large stake in the stock by institutions, Tesla's 
stock price might be vulnerable to their...","Sep 14, 2023",Yahoo Finance
https://www.bloomberg.com/news/articles/2023-12-08/elon-musk-forces-eco-conscious-scandinavians-to-choose-between-evs-and-unions,"Elon Musk Forces Eco-Conscious Scandinavians to Choose Between EVs and 
Unions","Elon Musk's abrasive way of doing business may be hurting Tesla Inc. in a 
region that has embraced electric cars more enthusiastically than...","Dec 7, 2023",Bloomberg
https://www.ocregister.com/2023/10/09/tesla-prices-now-rival-average-us-carsafter-billions-in-cuts/,Tesla prices rival average US cars after billions in cuts,"By Tom Randall | Bloomberg. Tesla Inc.'s top-selling electric vehicles now 
compete directly with gasoline cars on price after the latest...","Oct 9, 2023",Orange County Register
https://www.msn.com/en-us/money/markets/tesla-s-stock-dive-means-the-ev-maker-is-now-worth-less-than-broadcom/ar-BB1hOdZu,Tesla's stock dive means the EV maker is now worth less than Broadcom,"Shares of Tesla Inc. dove toward a nine-month low Monday to fuel a broad 
selloff in the electric-vehicle sector, after a report that the EV giant 
was losing...",4 weeks ago,MSN
https://simplywall.st/stocks/us/automobiles/nasdaq-tsla/tesla/news/the-price-is-right-for-tesla-inc-nasdaqtsla,"The Price Is Right For Tesla, Inc. (NASDAQ:TSLA)","We've established that Tesla maintains its high P/E on the strength of its 
forecast growth being higher than the wider market, as expected.",1 month ago,Simply Wall Street
https://www.bloomberg.com/news/articles/2023-12-08/tesla-fined-for-california-worker-pinned-in-car-on-conveyor-belt,Tesla Fined for California Worker Pinned in Car on Conveyor Belt,"Tesla Inc. has been cited by the California Division of Occupational Safety 
and Health for four safety violations after an employee was...","Dec 8, 2023",Bloomberg.com
https://www.bloomberg.com/news/articles/2023-10-09/tesla-prices-now-rival-average-us-cars-after-billions-in-cuts,Tesla Prices Now Rival Average US Cars After Billions in Cuts,"Tesla Inc.'s top-selling electric vehicles now compete directly with 
gasoline cars on price after the latest round of price reductions.","Oct 9, 2023",Bloomberg.com
https://www.bloomberg.com/news/articles/2023-07-24/tesla-is-lapping-germany-s-automakers-in-the-global-ev-race,Tesla Is Lapping Germany's Automakers in the Global EV Race,"Germany's automakers announced bold plans the last several years to shift 
to electric cars and challenge Tesla Inc.'s dominance.","Jul 24, 2023",Bloomberg.com
https://www.bnnbloomberg.ca/apple-s-ev-wind-down-offers-reprieve-to-tesla-and-detroit-rivals-1.2040050,Apple’s EV Wind Down Offers Reprieve to Tesla and Detroit Rivals,"(Bloomberg) -- The sudden demise of Apple Inc.'s electric vehicle program 
is a bleak sign for the car market. It's also a welcome boon for...",4 days ago,BNN Bloomberg
https://finance.yahoo.com/news/invested-1k-tesla-released-model-163510926.html,"If You Invested $1K In Tesla When It Released The Model S, Here's How Much 
You'd Have Today","Tesla is one of the most recognizable brands in the world. Not only is 
Tesla a leader in the electric vehicle (EV) space, but its CEO — Elon...","Oct 3, 2023",Yahoo Finance
https://www.bloomberg.com/news/articles/2023-10-05/where-is-tesla-s-ev-competition,Tesla's Year of Price Cuts Exposes Crisis for Legacy Auto,"With 61% of electric cars sales in the US, Tesla is now more dominant in 
EVs than Apple is in smartphones.","Oct 5, 2023",Bloomberg.com
https://finance.yahoo.com/news/unveiling-tesla-tsla-value-really-153259578.html,"Unveiling Tesla (TSLA)'s Value: Is It Really Priced Right? A Comprehensive 
Guide","Today, Tesla Inc (NASDAQ:TSLA) experienced a gain of 6.5%, marking a 
3-month gain of 8.19%. With an Earnings Per Share (EPS) (EPS) of 3.53,...","Sep 11, 2023",Yahoo Finance
https://www.bloomberg.com/news/articles/2023-10-19/tesla-valuation-looks-unsustainable-as-price-cuts-take-a-bite,"Is Tesla (TSLA) Stock Price Worth It? Investors, Analysts Unsure","Tesla Inc.'s price cuts this year show customers are no longer willing to 
pay a premium for its vehicles. That raises a key question on Wall...","Oct 19, 2023",Bloomberg.com
https://www.investopedia.com/what-you-need-to-know-ahead-of-elon-musk-s-tesla-earnings-8536167,What You Need to Know Ahead of Tesla's Earnings,"Tesla Inc. is to report earnings for the fourth quarter on Wednesday after 
market close, with analysts projecting revenue of around $25.88...",1 month ago,Investopedia
https://www.bloomberg.com/news/articles/2023-10-19/elon-musk-s-wealth-shrinks-by-16-billion-after-tesla-earnings-miss,"Elon Musk Wealth: World's Richest Slips by $16B on Tesla (TSLA) Earnings 
Miss","Elon Musk's fortune slumped by $16.1 billion Thursday after Tesla Inc.'s 
weak third-quarter earnings weighed on shares.","Oct 19, 2023",Bloomberg
https://www.nbcnews.com/business/business-news/judge-throws-elon-musks-56-billion-tesla-pay-package-rcna136468,Judge throws out Elon Musk's $56 billion Tesla pay package,"A Delaware judge on Tuesday voided the $56 billion pay package of Tesla CEO 
Elon Musk, ruling that the company's board of directors failed...",1 month ago,NBC News
https://finance.yahoo.com/news/tesla-inc-tsla-attracting-investor-130012797.html,"Tesla, Inc. (TSLA) is Attracting Investor Attention: Here is What You 
Should Know","Tesla is expected to post earnings of $0.79 per share for the current 
quarter, representing a year-over-year change of -24.8%. Over the last 30...","Aug 10, 2023",Yahoo Finance
https://www.bizjournals.com/austin/news/2024/01/03/tesla-austin-hutto-facility-megasite-elon-musk.html,"Elon Musk's Tesla Inc. has facility in Hutto, near Austin, city confirms","Tesla Inc.'s growing footprint in the Austin area now appears to include a 
sizable facility in Hutto. But what it's for remains unclear.","Jan 3, 2024",The Business Journals
https://news.bloomberglaw.com/daily-labor-report/tesla-allowed-to-ban-wearing-union-shirts-fifth-circuit-decides,"Tesla Allowed to Ban Wearing Union Shirts, 5th Cir. Decides (1)","Tesla Inc.'s ban on employees wearing union shirts on its electric car line 
is not a violation of federal labor law, a federal appeals court...","Nov 14, 2023",Bloomberg Law News
https://www.bloomberg.com/news/articles/2023-10-18/tesla-earnings-to-reveal-profit-impact-wrought-by-price-cuts,Tesla Earnings to Reveal Profit Impact Wrought by Price Cuts,"Investors have pushed Tesla Inc. stock higher for months despite 
deteriorating fundamentals. The electric-vehicle maker's results later...","Oct 18, 2023",Bloomberg
https://m.pulsenews.co.kr/view.php?sc=30800025&year=2024&no=129082,"Tesla Model Y hit by EV subsidy cuts for LFP battery cars - Pulse by Maeil 
Business News Korea","Seoul buyers of Tesla Inc.'s Model Y in 2024 will face a 2 million won 
($1,498.7) price hike compared to the previous year,...",1 week ago,Pulse News Korea
https://www.businessinsider.com/tesla-history-founders,"Tesla history: founders, when and how it started, timeline","Take a tour through Tesla's history from Silicon Valley startup to the 
world's most valuable car company.","Jun 22, 2023",Business Insider
https://www.tesla.com/2023shareholdermeeting,2023 Shareholder Meeting,"Tesla's Annual Shareholder Meeting will be held on Tuesday, May 16, 2023, 
at 3 PM Central Time.","May 16, 2023",Tesla
https://www.bloomberg.com/news/articles/2023-12-20/tesla-is-getting-trounced-by-s-p-500-three-years-after-joining,Tesla Stock (TSLA) Beaten by S&P 500 After Joining in 2020,"Exactly three years ago tomorrow, Tesla Inc. finally started trading on the 
S&P 500 Index. Since then, the company's stockholders have been...","Dec 20, 2023",Bloomberg.com
https://www.morningstar.com/news/marketwatch/20231221270/cathie-woods-etfs-are-now-buying-teslas-stock,Cathie Wood's ETFs are now buying Tesla's stock,"By Tomi Kilgore. The ARK Innovation ETF was previously a seller of Tesla 
stock, which is one of its largest holdings.","Dec 21, 2023",Morningstar
https://www.bloomberg.com/news/articles/2023-12-08/tesla-s-china-sales-rise-as-orders-flow-in-to-beat-price-rises,Tesla's China Sales Rise as Orders Flow In to Beat Price Rises,"Tesla Inc.'s Chinese deliveries rose in November as customers were 
motivated to place orders before the company increased prices on its...","Dec 8, 2023",Bloomberg.com
https://finance.yahoo.com/news/tesla-inc-tsla-significantly-undervalued-193214627.html,Is Tesla Inc (TSLA) Significantly Undervalued? A Deep Dive into the GF Value,"At its current price of $265.64 per share and a market cap of $843.1 
billion, Tesla appears to be significantly undervalued according to the 
GF...","Jul 28, 2023",Yahoo Finance
https://www.bloomberg.com/opinion/articles/2023-07-03/tesla-sales-surge-but-at-what-cost,"Tesla Sales Surge, But at What Cost?","Price cuts work — but only up to a point. Which is about all one can glean 
from Tesla Inc.'s latest quarterly sales numbers,...","Jul 3, 2023",Bloomberg
https://finance.yahoo.com/news/tesla-inc-tsla-significantly-undervalued-153426962.html,"Is Tesla Inc (TSLA) Significantly Undervalued? A Comprehensive Valuation 
Analysis","As of August 21, 2023, Tesla's stock price stands at $227.62 per share, 
with a market capitalization of $722.50 billion. However, the GF Value,...","Aug 21, 2023",Yahoo Finance
https://uk.investing.com/news/stock-market-news/the-forest-must-stay-treetop-protest-erupts-at-teslas-berlin-gigafactory-as-activists-try-to-thwart-expansion-3361130,"'The Forest Must Stay!' Treetop Protest Erupts At Tesla's Berlin 
Gigafactory As Activists Try To Thwart Expansion By ...","Benzinga - by Benzinga Neuro, Benzinga Staff Writer. Environmental 
activists have established a camp in the forest surrounding Tesla Inc.'s...",1 day ago,Investing.com UK
